{
  "id": "EVIDENCE-IMPLEMENTATION",
  "version": "1.0.0",
  "status": "partial",
  "updated": "2026-10-28",
  "entries": [
    {
      "id": "boundary-check",
      "command": "npm run lint",
      "started_at": "2026-10-28T09:25:16.112Z",
      "ended_at": "2026-10-28T09:25:16.385Z",
      "duration_ms": 272,
      "exit_code": 0,
      "revision": "4c395c7b7976ec32edeca243a516fd6cc0fec886",
      "worktree": "uncommitted implementation",
      "log_path": ".local/evidence/boundary-check.log",
      "log_sha256": "c4df8ffef6be74e744c761d27af9b1c951b57b6904969fe0d1a39fc4d3e9d446",
      "scope": "Executed local command only; no production or partner certification implied"
    },
    {
      "id": "local-regression",
      "command": "node --import tsx --test --test-concurrency=1 tests/business.test.ts tests/finance-invariants.test.ts tests/integration-adapters-studio.test.ts tests/integration-adapters.test.ts tests/platform.test.ts",
      "started_at": "2026-10-28T09:25:21.372Z",
      "ended_at": "2026-10-28T09:25:26.446Z",
      "duration_ms": 5073,
      "exit_code": 0,
      "revision": "4c395c7b7976ec32edeca243a516fd6cc0fec886",
      "worktree": "uncommitted implementation",
      "log_path": ".local/evidence/local-regression.log",
      "log_sha256": "3ff049297cee7559048c05077c738d4d6d05208d16c49c942912841e657c05d0",
      "scope": "Executed local command only; no production or partner certification implied"
    },
    {
      "id": "bundle-budgets",
      "command": "node scripts/bundle-budgets.mjs",
      "started_at": "2026-10-28T09:27:33.299Z",
      "ended_at": "2026-10-28T09:27:34.035Z",
      "duration_ms": 721,
      "exit_code": 1,
      "revision": "4c395c7b7976ec32edeca243a516fd6cc0fec886",
      "worktree": "uncommitted implementation",
      "log_path": ".local/evidence/bundle-budgets.log",
      "log_sha256": "7bccadc97806accb884a5072206c335093c76e02f3703813986b47d19daa754f",
      "scope": "Executed local command only; no production or partner certification implied"
    },
    {
      "id": "performance-smoke",
      "command": "node --import tsx scripts/performance-smoke.ts",
      "started_at": "2026-10-28T09:27:36.251Z",
      "ended_at": "2026-10-28T09:27:46.579Z",
      "duration_ms": 10329,
      "exit_code": 0,
      "revision": "4c395c7b7976ec32edeca243a516fd6cc0fec886",
      "worktree": "uncommitted implementation",
      "log_path": ".local/evidence/performance-smoke.log",
      "log_sha256": "e4a02ca7663f61f97c4230dd3275079dd878bfc7abe83e6b4b80a629416cd574",
      "scope": "Executed local command only; no production or partner certification implied"
    },
    {
      "id": "finance-platform-node24",
      "command": "node --env-file=.env.local --import tsx --test --test-concurrency=1 tests/finance-platform.test.ts",
      "started_at": "2026-10-28T10:08:02.270Z",
      "ended_at": "2026-10-28T10:08:03.793Z",
      "duration_ms": 1508,
      "exit_code": 0,
      "revision": "4c395c7b7976ec32edeca243a516fd6cc0fec886",
      "worktree": "uncommitted implementation",
      "source_sha256": "fd120af8b6ac8d80c4bce554be3b4e977e0ed4341201de91451a44d61be30975",
      "source_after_sha256": "fd120af8b6ac8d80c4bce554be3b4e977e0ed4341201de91451a44d61be30975",
      "source_changed_during_run": false,
      "source_snapshot_path": ".local/evidence/finance-platform-node24-sources.json",
      "log_path": ".local/evidence/finance-platform-node24.log",
      "log_sha256": "2cc15db8b56c1d78465906ef29d365c038e78c1bb0b2b17f69323977ed2adce5",
      "scope": "Executed local command only; no production or partner certification implied"
    },
    {
      "id": "local-regression-node24",
      "command": "node --env-file=.env.local --import tsx --test --test-concurrency=1 tests/business.test.ts tests/finance-invariants.test.ts tests/finance-servicing.test.ts tests/finance-platform.test.ts tests/integration-adapters-studio.test.ts tests/integration-adapters.test.ts tests/platform.test.ts tests/recovery.test.ts",
      "started_at": "2026-10-28T10:09:17.240Z",
      "ended_at": "2026-10-28T10:09:25.051Z",
      "duration_ms": 7809,
      "exit_code": 0,
      "revision": "4c395c7b7976ec32edeca243a516fd6cc0fec886",
      "worktree": "uncommitted implementation",
      "source_sha256": "4bb8fdb3e485a116e4b69f41380b6736534fcfe711e7d98e16070c685c4c6dd0",
      "source_after_sha256": "4bb8fdb3e485a116e4b69f41380b6736534fcfe711e7d98e16070c685c4c6dd0",
      "source_changed_during_run": false,
      "source_snapshot_path": ".local/evidence/local-regression-node24-sources.json",
      "log_path": ".local/evidence/local-regression-node24.log",
      "log_sha256": "f87a0eaf25c289687f4c77ebe5875a825cdcc27cb5251c3cbdf62c8fadc3d0a6",
      "scope": "Executed local command only; no production or partner certification implied"
    },
    {
      "id": "performance-smoke-node24",
      "command": "node --env-file=.env.local --import tsx scripts/performance-smoke.ts",
      "started_at": "2026-10-28T10:10:28.401Z",
      "ended_at": "2026-10-28T10:10:38.722Z",
      "duration_ms": 10313,
      "exit_code": 0,
      "revision": "4c395c7b7976ec32edeca243a516fd6cc0fec886",
      "worktree": "uncommitted implementation",
      "source_sha256": "4bb8fdb3e485a116e4b69f41380b6736534fcfe711e7d98e16070c685c4c6dd0",
      "source_after_sha256": "4bb8fdb3e485a116e4b69f41380b6736534fcfe711e7d98e16070c685c4c6dd0",
      "source_changed_during_run": false,
      "source_snapshot_path": ".local/evidence/performance-smoke-node24-sources.json",
      "log_path": ".local/evidence/performance-smoke-node24.log",
      "log_sha256": "79f1b6c143ee0e815797ad9aa86a68dc49bc378224e91fb2854096fac43bca20",
      "scope": "Executed local command only; no production or partner certification implied"
    },
    {
      "id": "clean-build-node24",
      "command": "npm --prefix .local/locked-install run build",
      "started_at": "2026-10-28T10:10:50.350Z",
      "ended_at": "2026-10-28T10:11:07.628Z",
      "duration_ms": 17273,
      "exit_code": 0,
      "revision": "4c395c7b7976ec32edeca243a516fd6cc0fec886",
      "worktree": "uncommitted implementation",
      "source_sha256": "4bb8fdb3e485a116e4b69f41380b6736534fcfe711e7d98e16070c685c4c6dd0",
      "source_after_sha256": "4bb8fdb3e485a116e4b69f41380b6736534fcfe711e7d98e16070c685c4c6dd0",
      "source_changed_during_run": false,
      "source_snapshot_path": ".local/evidence/clean-build-node24-sources.json",
      "log_path": ".local/evidence/clean-build-node24.log",
      "log_sha256": "aa3ad614390e82ac7b6c94c802ac70f13dcf329e723ec6b3e66ba041ef1c77a0",
      "scope": "Executed local command only; no production or partner certification implied"
    },
    {
      "id": "frontend-build-node24",
      "command": "npm run build -w @st/web",
      "started_at": "2026-10-28T10:15:59.950Z",
      "ended_at": "2026-10-28T10:16:04.629Z",
      "duration_ms": 4669,
      "exit_code": 0,
      "revision": "4c395c7b7976ec32edeca243a516fd6cc0fec886",
      "worktree": "uncommitted implementation",
      "source_sha256": "e487a821b835051b1b39e9b20c2e015717042115e00d15894c415c98e75395d0",
      "source_after_sha256": "e487a821b835051b1b39e9b20c2e015717042115e00d15894c415c98e75395d0",
      "source_changed_during_run": false,
      "source_snapshot_path": ".local/evidence/frontend-build-node24-sources.json",
      "log_path": ".local/evidence/frontend-build-node24.log",
      "log_sha256": "83a5967946fd36ae8a03046ad0ed7450298dfe76bf73ba386088951154293ec3",
      "scope": "Executed local command only; no production or partner certification implied"
    },
    {
      "id": "frontend-final-node24",
      "command": "npm exec -- playwright test -c tests/e2e/playwright.config.ts",
      "started_at": "2026-10-28T10:16:42.410Z",
      "ended_at": "2026-10-28T10:18:45.332Z",
      "duration_ms": 122921,
      "exit_code": 1,
      "revision": "4c395c7b7976ec32edeca243a516fd6cc0fec886",
      "worktree": "uncommitted implementation",
      "source_sha256": "8cc49a06e7230211d32bd86b6103455be3cd91433d101b017f4c6362f6450944",
      "source_after_sha256": "287d2b02f57b307eea42d2ad07d0093bb8bacf06248e6c5acd3a4fe18a4b328e",
      "source_changed_during_run": true,
      "source_snapshot_path": ".local/evidence/frontend-final-node24-sources.json",
      "log_path": ".local/evidence/frontend-final-node24.log",
      "log_sha256": "9ac921dd129fbc4a794b792c969e9041d4428dd391e0baa5e703f2dd9bc346fc",
      "scope": "Executed local command only; no production or partner certification implied"
    },
    {
      "id": "contract-standards-node24",
      "command": "node docs/_meta/validation/validate_standards.mjs",
      "started_at": "2026-10-28T10:19:10.992Z",
      "ended_at": "2026-10-28T10:19:12.267Z",
      "duration_ms": 1272,
      "exit_code": 0,
      "revision": "4c395c7b7976ec32edeca243a516fd6cc0fec886",
      "worktree": "uncommitted implementation",
      "source_sha256": "edcd681d757808e100c14c62c0dc03befe1f58f45a2d3b3b3d38597f99b6f278",
      "source_after_sha256": "edcd681d757808e100c14c62c0dc03befe1f58f45a2d3b3b3d38597f99b6f278",
      "source_changed_during_run": false,
      "source_snapshot_path": ".local/evidence/contract-standards-node24-sources.json",
      "log_path": ".local/evidence/contract-standards-node24.log",
      "log_sha256": "56d3ffff6611f1aea13da5ff12cb7e44745041d84a2cb438745a2b7a9db50666",
      "scope": "Executed local command only; no production or partner certification implied"
    },
    {
      "id": "frontend-final-node24-v2",
      "command": "npm exec -- playwright test -c tests/e2e/playwright.config.ts",
      "started_at": "2026-10-28T10:21:48.783Z",
      "ended_at": "2026-10-28T10:22:14.717Z",
      "duration_ms": 25929,
      "exit_code": 0,
      "revision": "4c395c7b7976ec32edeca243a516fd6cc0fec886",
      "worktree": "uncommitted implementation",
      "source_sha256": "187da35050665de173766febac8b9cde2d1dae4180a33951923be1404cbb1113",